{
  "schema_version": "1.0.0",
  "trip_id": "balkan-roadtrip-2026",
  "updated_at": "2026-07-12T20:00:00+02:00",
  "activities": [
    {
      "id": "sarajevo-heritage-walk",
      "title": "Sarajevo – mesto srečevanja kultur",
      "subtitle": "Samostojni sprehod po zgodovinskem središču",
      "type": "city_walk",
      "theme": "history",
      "format": "full_guide",
      "status": "ready",
      "trip_day_refs": [
        5
      ],
      "country": "Bosna in Hercegovina",
      "region": "Kanton Sarajevo",
      "city": "Sarajevo",
      "summary": "Krožni sprehod skozi katoliško, pravoslavno, judovsko, osmansko in avstro-ogrsko dediščino Sarajeva.",
      "why_choose": [
        "Za celovit prvi stik z zgodovinskim središčem Sarajeva.",
        "Za razumevanje mesta kot stičišča vzhoda in zahoda.",
        "Za samostojen ogled, ki se ne prekriva z rezerviranim vojnim tourom."
      ],
      "duration": {
        "min_minutes": 180,
        "max_minutes": 330,
        "walking_minutes": 55,
        "display": "3–5,5 ure"
      },
      "distance": {
        "total_km": 4.1,
        "walking_km": 4.1,
        "display": "približno 4,1 km"
      },
      "difficulty": "easy",
      "arrival": {
        "mode": [
          "walk",
          "public_transport",
          "taxi"
        ],
        "instructions": "Začetek je pri Katedrali Srca Jezusovega; konec pri Muzeju Sarajeva 1878–1918 ob Latinskem mostu."
      },
      "route": {
        "shape": "point_to_point",
        "start_stop_id": "sarajevo-sacred-heart",
        "end_stop_id": "sarajevo-assassination-museum",
        "route_note": "Trasa je urejena tako, da se iz avstro-ogrskega dela postopoma preide v osmansko jedro in nato do Miljacke.",
        "map": {
          "google_maps_url": "https://www.google.com/maps/dir/Sacred+Heart+Cathedral+Sarajevo/Sarajevo+Museum+1878-1918"
        },
        "stops": [
          {
            "id": "sarajevo-sacred-heart",
            "order": 1,
            "title": "Katedrala Srca Jezusovega",
            "local_name": "Katedrala Srca Isusova",
            "category": "church",
            "google_maps_url": "https://www.google.com/maps/search/?api=1&query=Sacred+Heart+Cathedral+Sarajevo",
            "visit_minutes": 15,
            "guide_text": "Največja katoliška cerkev v Bosni in Hercegovini je bila zgrajena med letoma 1884 in 1889 po načrtih Josipa Vancaša. Neogotsko pročelje z dvema približno 43 metrov visokima zvonikoma je eden najbolj prepoznavnih simbolov avstro-ogrskega Sarajeva.",
            "what_to_notice": [
              "rozeta",
              "dvojna zvonika",
              "kip papeža Janeza Pavla II.",
              "vitraji"
            ],
            "official_url": "https://www.vrhbosanska-nadbiskupija.org/"
          },
          {
            "id": "sarajevo-orthodox-cathedral",
            "order": 2,
            "title": "Stolna cerkev Rojstva Presvete Bogorodice",
            "category": "church",
            "google_maps_url": "https://www.google.com/maps/search/?api=1&query=Cathedral+Church+of+the+Nativity+of+the+Theotokos+Sarajevo",
            "visit_minutes": 15,
            "guide_text": "Glavna pravoslavna cerkev v Sarajevu je nastala med letoma 1863 in 1872 po načrtih Andreje Damjanova. Njena monumentalna podoba priča o spremembah v poznem Osmanskem cesarstvu in o vidni prisotnosti pravoslavne skupnosti v mestni veduti.",
            "what_to_notice": [
              "pet kupol",
              "zvonik",
              "ikonostas"
            ]
          },
          {
            "id": "sarajevo-jewish-museum",
            "order": 3,
            "title": "Judovski muzej Bosne in Hercegovine",
            "local_name": "Stari hram / Il Kal Grandi",
            "category": "museum",
            "google_maps_url": "https://www.google.com/maps/search/?api=1&query=Jewish+Museum+of+Bosnia+and+Herzegovina+Sarajevo",
            "visit_minutes": 40,
            "guide_text": "Muzej je urejen v najstarejši ohranjeni sinagogi v Bosni in Hercegovini iz leta 1581. Predstavlja zgodovino sefardskih Judov, njihov ladino jezik, vsakdanje življenje, kulturne dosežke in tragedijo holokavsta.",
            "practical_note": "Sarajevska hagada ni stalno razstavljena tukaj, temveč jo hrani Zemaljski muzej Bosne in Hercegovine.",
            "official_url": "https://www.muzejsarajeva.ba/en/Depandansi/muzej-jevreja-bih/"
          },
          {
            "id": "sarajevo-meeting-cultures",
            "order": 4,
            "title": "Sarajevo Meeting of Cultures",
            "category": "landmark",
            "google_maps_url": "https://www.google.com/maps/search/?api=1&query=Sarajevo+Meeting+of+Cultures",
            "visit_minutes": 10,
            "guide_text": "Talna oznaka na Ferhadiji simbolno označuje prehod med avstro-ogrskim in osmanskim urbanim prostorom. Pogled proti zahodu razkriva srednjeevropske fasade, proti vzhodu pa nizko, orientalsko zasnovo Baščaršije.",
            "photo_tip": "Naredi dve fotografiji z iste točke: eno proti vzhodu in eno proti zahodu.",
            "official_url": "https://smoc.ba/en/home"
          },
          {
            "id": "sarajevo-hotel-europe",
            "order": 5,
            "title": "Hotel Europe",
            "category": "landmark",
            "google_maps_url": "https://www.google.com/maps/search/?api=1&query=Hotel+Europe+Sarajevo",
            "visit_minutes": 10,
            "guide_text": "Hotel, odprt leta 1882 po načrtih Karla Paříka, predstavlja prihod srednjeevropskega hotelirstva in meščanske kulture v Sarajevo. Njegova lega ob ostankih Tašlihana skoraj dobesedno sooči osmanski han in sodobni avstro-ogrski hotel.",
            "official_url": "https://www.hoteleuropegroup.ba/hotel-europe/"
          },
          {
            "id": "sarajevo-taslihan",
            "order": 6,
            "title": "Tašlihan",
            "category": "landmark",
            "google_maps_url": "https://maps.google.com/?q=Tašlihan+Sarajevo",
            "visit_minutes": 10,
            "guide_text": "Kamniti han je nastal v prvi polovici 16. stoletja kot del zadolžbine Gazi Husrev-bega. Bil je trgovsko-prenočitveni kompleks s skladišči, hlevi in sobami za trgovce; danes so ohranjeni predvsem temelji ob Hotelu Europe."
          },
          {
            "id": "sarajevo-bezistan",
            "order": 7,
            "title": "Gazi Husrev-begov bezistan",
            "category": "landmark",
            "google_maps_url": "https://maps.google.com/?q=Gazi+Husrev+Beg+Bezistan",
            "visit_minutes": 10,
            "guide_text": "Pokrita tržnica iz 16. stoletja je bila namenjena prodaji dragocenega blaga. Kamniti oboki in majhne odprtine v kupolah ohranjajo prijetno hladno ozračje, prostor pa svojo trgovsko funkcijo opravlja že skoraj pet stoletij."
          },
          {
            "id": "sarajevo-gazi-husrev-mosque",
            "order": 8,
            "title": "Gazi Husrev-begova mošeja",
            "category": "mosque",
            "google_maps_url": "https://maps.google.com/?q=Gazi+Husrev+Beg+Mosque",
            "visit_minutes": 25,
            "guide_text": "Najpomembnejša islamska verska stavba v Bosni in Hercegovini je bila dokončana leta 1531. Zasnoval jo je osmanski glavni arhitekt Adžem Esir Ali, predhodnik Mimarja Sinana. Posebno pozornost namenita šadrvanu, kupoli in minaretu.",
            "official_url": "https://begovadzamija.ba"
          },
          {
            "id": "sarajevo-clock-tower",
            "order": 9,
            "title": "Sahat-kula",
            "category": "landmark",
            "google_maps_url": "https://maps.google.com/?q=Sahat+Kula+Sarajevo",
            "visit_minutes": 10,
            "guide_text": "Stolp prikazuje tradicionalni čas alla turca, pri katerem se dan začne ob sončnem zahodu. Ker se ta vsak dan spreminja, je uro treba redno nastavljati."
          },
          {
            "id": "sarajevo-kursumlija",
            "order": 10,
            "title": "Kuršumlija medresa",
            "category": "landmark",
            "google_maps_url": "https://maps.google.com/?q=Kuršumlija+Madrasa+Sarajevo",
            "visit_minutes": 10,
            "guide_text": "Najstarejša islamska šola v Sarajevu je dobila ime po svinčeni strehi. Poleg teologije so poučevali matematiko, astronomijo, logiko, filozofijo, pravo in jezike."
          },
          {
            "id": "sarajevo-ghb-library",
            "order": 11,
            "title": "Gazi Husrev-begova knjižnica",
            "category": "museum",
            "google_maps_url": "https://maps.google.com/?q=Gazi+Husrev+Beg+Library",
            "visit_minutes": 30,
            "guide_text": "Ena največjih zakladnic pisne dediščine jugovzhodne Evrope hrani več kot sto tisoč knjig, rokopisov in dokumentov v arabščini, turščini, perzijščini in bosanščini v arabici.",
            "official_url": "https://ghb.ba"
          },
          {
            "id": "sarajevo-morica-han",
            "order": 12,
            "title": "Morića Han",
            "category": "landmark",
            "google_maps_url": "https://maps.google.com/?q=Morica+Han+Sarajevo",
            "visit_minutes": 10,
            "guide_text": "Najbolje ohranjeni sarajevski karavanseraj je bil zgrajen v 16. stoletju. Veliko dvorišče, leseni balkoni in kamnite arkade še danes pričarajo podobo nekdanjega postajališča trgovskih karavan."
          },
          {
            "id": "sarajevo-kazandziluk",
            "order": 13,
            "title": "Kazandžiluk",
            "category": "landmark",
            "google_maps_url": "https://maps.google.com/?q=Kazandziluk+Sarajevo",
            "visit_minutes": 15,
            "guide_text": "Ulica bakrorezcev že stoletja ohranja tradicionalno obrt izdelovanja kotlov, džezv, pladnjev in okrasnih predmetov. Prisluhnita ritmičnemu zvoku kladiv iz delavnic."
          },
          {
            "id": "sarajevo-sebilj",